{"type":"config","name":"genomespot-composite","metricName":"composite_score","metricUnit":"","bestDirection":"higher"}
{"run":8,"commit":"ec503c5","metric":0.623770,"metrics":{"oxygen_f1":0.943791,"temperature_r2":0.707157,"salinity_r2":0.596755,"ph_r2":0.435573,"temperature_rmse":6.5494,"salinity_rmse":2.7404,"ph_rmse":1.0537},"status":"discard","description":"VotingRegressor(Lasso+Ridge) on 60 AA features","timestamp":1773636486,"segment":0}
{"run":12,"commit":"bf5853b","metric":0.633644,"metrics":{"oxygen_f1":0.943791,"temperature_r2":0.706746,"salinity_r2":0.612032,"ph_r2":0.452826,"temperature_rmse":6.5523,"salinity_rmse":2.6900,"ph_rmse":1.0380},"status":"discard","description":"Sal: +extracellular pis_4_5. pH: swap thermostable for pis_4_5+proportion_R_RK","timestamp":1773637109,"segment":0}
{"run":16,"commit":"790b7b6","metric":0.635560,"metrics":{"oxygen_f1":0.940748,"temperature_r2":0.706746,"salinity_r2":0.612492,"ph_r2":0.458908,"temperature_rmse":6.5523,"salinity_rmse":2.6856,"ph_rmse":1.0319},"status":"discard","description":"Oxygen: all 4 compartments (too many features)","timestamp":1773637602,"segment":0}
{"run":20,"commit":"8171477","metric":0.629989,"metrics":{"oxygen_f1":0.950121,"temperature_r2":0.706875,"salinity_r2":0.614275,"ph_r2":0.439338,"temperature_rmse":6.5508,"salinity_rmse":2.6997,"ph_rmse":1.0510},"status":"discard","description":"LassoCV for all regression (pH hurt by inner CV mismatch)","timestamp":1773643356,"segment":0}
{"run":21,"commit":"0c2f5da","metric":0.637791,"metrics":{"oxygen_f1":0.950121,"temperature_r2":0.706746,"salinity_r2":0.614275,"ph_r2":0.458908,"temperature_rmse":6.5523,"salinity_rmse":2.6997,"ph_rmse":1.0319},"status":"keep","description":"Salinity: LassoCV auto-alpha","timestamp":1773644041,"segment":0}
{"run":23,"commit":"8af8837","metric":0.627404,"metrics":{"oxygen_f1":0.950121,"temperature_r2":0.706875,"salinity_r2":0.614275,"ph_r2":0.432876,"temperature_rmse":6.5508,"salinity_rmse":2.6997,"ph_rmse":1.0583},"status":"discard","description":"pH: ElasticNetCV (inner CV mismatch hurts)","timestamp":1773645752,"segment":0}
{"run":28,"commit":"c95a109","metric":0.635906,"metrics":{"oxygen_f1":0.950121,"temperature_r2":0.707568,"salinity_r2":0.610340,"ph_r2":0.455750,"temperature_rmse":6.5429,"salinity_rmse":2.7032,"ph_rmse":1.0361},"status":"discard","description":"RobustScaler for regression (slightly worse than StandardScaler)","timestamp":1773649481,"segment":0}
{"run":29,"commit":"d27edef","metric":0.638250,"metrics":{"oxygen_f1":0.950121,"temperature_r2":0.707942,"salinity_r2":0.614275,"ph_r2":0.459456,"temperature_rmse":6.5419,"salinity_rmse":2.6997,"ph_rmse":1.0316},"status":"keep","description":"pH: +all_mean_pi (whole-proteome mean pI)","timestamp":1773649896,"segment":0}
{"run":30,"commit":"d0498dc","metric":0.639560,"metrics":{"oxygen_f1":0.950121,"temperature_r2":0.707942,"salinity_r2":0.614275,"ph_r2":0.462733,"temperature_rmse":6.5419,"salinity_rmse":2.6997,"ph_rmse":1.0285},"status":"keep","description":"pH: +all_pis_basic (proportion basic-pI proteins)","timestamp":1773650624,"segment":0}
{"run":32,"commit":"8805349","metric":0.638914,"metrics":{"oxygen_f1":0.950121,"temperature_r2":0.707942,"salinity_r2":0.614275,"ph_r2":0.461117,"temperature_rmse":6.5419,"salinity_rmse":2.6997,"ph_rmse":1.0301},"status":"discard","description":"pH: +extracellular_pis_acidic (added noise, redundant)","timestamp":1773651974,"segment":0}
{"run":37,"commit":"4267e23","metric":0.640945,"metrics":{"oxygen_f1":0.950121,"temperature_r2":0.707942,"salinity_r2":0.611535,"ph_r2":0.467565,"temperature_rmse":6.5419,"salinity_rmse":2.6720,"ph_rmse":1.0240},"status":"discard","description":"Sal: +mean_zc (N=473 cant support more features)","timestamp":1773654554,"segment":0}
{"run":44,"commit":"b3d3e8d","metric":0.643226,"metrics":{"oxygen_f1":0.948724,"temperature_r2":0.707942,"salinity_r2":0.614275,"ph_r2":0.472595,"temperature_rmse":6.5419,"salinity_rmse":2.6997,"ph_rmse":1.0212},"status":"discard","description":"O2: BaggingClassifier(LogReg) — near ceiling, bagging adds noise","timestamp":1773659654,"segment":0}
{"run":46,"commit":"d69b427","metric":0.642312,"metrics":{"oxygen_f1":0.950121,"temperature_r2":0.708048,"salinity_r2":0.608202,"ph_r2":0.472595,"temperature_rmse":6.5363,"salinity_rmse":2.7110,"ph_rmse":1.0212},"status":"discard","description":"Sal: BaggingRegressor(Lasso 0.01) — LassoCV still better","timestamp":1773660973,"segment":0}
{"run":48,"commit":"2c15309","metric":0.641986,"metrics":{"oxygen_f1":0.950121,"temperature_r2":0.708048,"salinity_r2":0.614275,"ph_r2":0.468744,"temperature_rmse":6.5363,"salinity_rmse":2.6997,"ph_rmse":1.0248},"status":"discard","description":"pH: +extracellular pI features with Bagging (still noise)","timestamp":1773662361,"segment":0}
{"run":50,"commit":"80bd995","metric":0.644419,"metrics":{"oxygen_f1":0.950121,"temperature_r2":0.711049,"salinity_r2":0.614275,"ph_r2":0.473326,"temperature_rmse":6.5106,"salinity_rmse":2.6997,"ph_rmse":1.0205},"status":"discard","description":"Temp: +pur_pyr+mean_protein_length (noise)","timestamp":1773663038,"segment":0}
